<?xml version="1.0" encoding="UTF-8" standalone="no"?>
<validationRuleSet
    xmlns:val="http://www.jboss.org/tools/komodo/validation/2015"
    xmlns:ddl="http://www.modeshape.org/ddl/1.0"
    xmlns:vdb="http://www.metamatrix.com/metamodels/VirtualDatabase"
    xmlns:xsi="http://www.w3.org/2001/XMLSchema-instance"
    xsi:schemaLocation="http://www.jboss.org/tools/komodo/validation/2015 http://www.jboss.org/tools/komodo/validation/2015/komodoValidation.xsd"
    xmlns="http://www.jboss.org/tools/komodo/validation/2015">

    <description locale="en">This is the relational model validation file.</description>

    <nodeValidation jcrName="vdb:virtualDatabase">
        <message locale="en">Validation rules for the 'vdb:virtualDatabase' node type.</message>
        <!-- <nameValidation id="vdb.name"> <message locale="en">Validates the name of nodes having the 'vdb:virtualDatabase' node 
            type.</message> <pattern>[a-z]*</pattern> </nameValidation> -->
        <propertyValidation jcrName="vdb:name">
            <message locale="en">Rules that validate the property 'vdb:name' of the 'vdb:virtualDatabase' node type.</message>
            <requiredValidation id="vdb.name.required">
                <message locale="en">The property 'vdb:name' of the 'vdb:virtualDatabase' node type is required.</message>
            </requiredValidation>
        </propertyValidation>

        <propertyValidation jcrName="vdb:version">
            <message locale="en">Rules that validate the property 'vdb:version' of the 'vdb:virtualDatabase' node type.
            </message>
            <requiredValidation id="vdb.version.required">
                <message locale="en">The property 'vdb:version' of the 'vdb:virtualDatabase' node type is required.</message>
            </requiredValidation>
            <valueValidation id="vdb:version.value">
                <message locale="en">The value of property 'vdb:version' is invalid.</message>
                <pattern>[0-9]+</pattern>
            </valueValidation>
        </propertyValidation>

        <propertyValidation jcrName="vdb:originalFile">
            <message locale="en">Rules that validate the property 'vdb:originalFile' of the 'vdb:virtualDatabase' node type.
            </message>
            <requiredValidation id="vdb.originalFile.required">
                <message locale="en">The property 'vdb:originalFile' of the 'vdb:virtualDatabase' node type is required.
                </message>
            </requiredValidation>
        </propertyValidation>
    </nodeValidation>

    <nodeValidation jcrName="vdb:declarativeModel">
        <message locale="en">Validation rules for the 'vdb:declarativeModel' node type.</message>
        <propertyValidation jcrName="mmcore:modelType">
            <message locale="en">Rules that validate the property 'mmcore:modelType' of the 'vdb:virtualDatabase' node type.
            </message>
            <requiredValidation id="declarativeModel.modelType.required">
                <message locale="en">The property 'mmcore:modelType' of the 'vdb:virtualDatabase' node type is required.
                </message>
            </requiredValidation>
        </propertyValidation>
   </nodeValidation>
</validationRuleSet>
