<?xml version="1.0" encoding="UTF-8" standalone="no"?>
<validationRuleSet
    xmlns:val="http://www.jboss.org/tools/komodo/validation/2015"
    xmlns:ddl="http://www.modeshape.org/ddl/1.0"
    xmlns:vdb="http://www.metamatrix.com/metamodels/VirtualDatabase"
    xmlns:xsi="http://www.w3.org/2001/XMLSchema-instance"
    xsi:schemaLocation="http://www.jboss.org/tools/komodo/validation/2015 http://www.jboss.org/tools/komodo/validation/2015/komodoValidation.xsd"
    xmlns="http://www.jboss.org/tools/komodo/validation/2015">

    <description locale="en">This is a test validation file.</description>
    <description locale="es">Este es un archivo de validación de pruebas.</description>

    <nodeValidation jcrName="vdb:virtualDatabase">
        <message locale="en">Validation rules for a VDB.</message>
        <message locale="es">Las reglas de validación para el tipo de nodo 'vdb:virtualDatabase.'</message>

        <propertyValidation jcrName="vdb:connectionType">
            <message locale="en">Validates a VDB's connection type.</message>
            <requiredValidation id="vdb.connectionType.required">
                <description locale="en">The VDB connection type is required.</description>
            </requiredValidation>
        </propertyValidation>
    </nodeValidation>

</validationRuleSet>
